Row Type,Action,Ad status,Campaign ID,Campaign,Ad group,Ad type,Headline 1,Headline 2,Headline 3,Headline 4,Headline 5,Headline 6,Headline 7,Headline 8,Headline 9,Headline 10,Headline 11,Headline 12,Headline 13,Description 1,Description 2,Description 3,Description 4,Headline 1 position,Path 1,Path 2,Final URL
Ad,Add,Enabled,23690057178,Campaign #1,Lisbon Photographers,Responsive search ad,Photographer in Lisbon,Lisbon Photoshoot From €150,Verified Pros in Lisbon,Couples & Family Photos,See Portfolios & Reviews,Book Online in 2 Minutes,Secure Payment Guaranteed,Hand-Picked Local Pros,Photos Ready in 5 Days,Top-Rated in Lisbon,Free Cancellation Policy,Couples Proposals Solo,Alfama Belem & More,Verified photographers in Lisbon. See portfolios and real reviews. Book in 2 min.,Professional photoshoots in Lisbon. Hand-picked local pros. Secure payment from €150.,Capture your Lisbon trip with a local pro. See works and reviews before you book.,From €150. Hand-picked and verified. See portfolios before you book.,1,photographers,lisbon,https://photoportugal.com/photographers?location=lisbon
Ad,Add,Enabled,23690057178,Campaign #1,Porto Photographers,Responsive search ad,Photographer in Porto,Porto Photoshoot From €150,Verified Pros in Porto,Capture Your Porto Trip,See Portfolios & Reviews,Book Online in 2 Minutes,Secure Payment Guaranteed,Hand-Picked Local Pros,Photos Ready in 5 Days,Top-Rated in Porto,Free Cancellation Policy,Couples Proposals Solo,Ribeira & Douro Views,Verified photographers in Porto. See portfolios and reviews. Book in 2 minutes.,Professional photoshoots in Porto. Hand-picked local pros. Secure payment from €150.,Capture your Porto vacation with a local pro. Browse real works and reviews.,From €150. Hand-picked and verified. See portfolios before you book.,1,photographers,porto,https://photoportugal.com/photographers?location=porto
Ad,Add,Enabled,23690057178,Campaign #1,Algarve Photographers,Responsive search ad,Photographer in Algarve,Algarve Photoshoot From €150,Beach & Cliff Photoshoots,Capture Your Algarve Trip,See Portfolios & Reviews,Book Online in 2 Minutes,Secure Payment Guaranteed,Hand-Picked Local Pros,Photos Ready in 5 Days,Top-Rated in Algarve,Free Cancellation Policy,Lagos Albufeira Faro,Golden Coast Photos,Verified photographers in Algarve. Stunning beach and cliff locations. From €150.,Professional photoshoots in Algarve. Hand-picked local pros. Secure payment.,Capture your Algarve holiday. Beaches cliffs and golden coast. Book in 2 min.,From €150. Hand-picked and verified. See portfolios before you book.,1,photographers,algarve,https://photoportugal.com/photographers?location=algarve
Ad,Add,Enabled,23690057178,Campaign #1,Sintra Photographers,Responsive search ad,Photographer in Sintra,Sintra Palace Photoshoot,Magical Sintra Photos,Fairytale Photos in Sintra,See Portfolios & Reviews,Book Online in 2 Minutes,Secure Payment Guaranteed,Hand-Picked Local Pros,Photos Ready in 5 Days,Top-Rated in Sintra,Free Cancellation Policy,Pena Palace & Gardens,Enchanted Forest Photos,Photographer in Sintra. Pena Palace castles and gardens. Portfolios. From €150.,Capture the magic of Sintra with a local pro. Book online. Secure payment.,Fairytale photoshoots at Sintra palaces and gardens. Verified photographers.,From €150. Hand-picked and verified. See portfolios before you book.,1,photographers,sintra,https://photoportugal.com/photographers?location=sintra
Ad,Add,Enabled,23690057178,Campaign #1,Portugal General,Responsive search ad,Photoshoot in Portugal,Book a Portugal Photographer,Honeymoon Photos Portugal,Elopement Photographer PT,25+ Locations in Portugal,Book Online in 2 Minutes,Secure Payment Guaranteed,Hand-Picked Local Pros,Photos Ready in 5 Days,Top-Rated Photographers,Free Cancellation Policy,Lisbon Porto Algarve,From €150 Verified Pros,Vacation photoshoots across Portugal. Couples families proposals. 25+ locations.,Hand-picked photographers in Lisbon Porto Algarve and more. See portfolios.,Book a verified photographer anywhere in Portugal. See works and reviews.,From €150. Hand-picked and verified. See portfolios before you book.,1,photographers,book,https://photoportugal.com/photographers
